csvbase_row_id,title,year,release_date,runtime,genre5,genre_detailed,rated,director,writer,actors,language,country,metascore,imdb_rating,imdb_votes,imdb_id,studio,bechdel_binary,bechdel_ordinal,us_gross,int_gross,budget,men_lines,lines_data
618,The Beach,2000,2000-02-11,1.983333,Drama,"Adventure, Drama, Romance, Thriller",R,Danny Boyle,"John Hodge (screenplay), Alex Garland (novel)","Leonardo DiCaprio, Daniel York, Patcharawan Patarakijjanon, Virginie Ledoyen","English, French, Swedish, Thai, Serbian","USA, UK",43.0,6.6,203902,tt0163978,20th Century Fox,False,notalk,53816800,53816800,67645419,0.759229534510433,76777754767656777235777775766655777773435677776344332443465775334443437437367676354743466
619,The Best Exotic Marigold Hotel,2011,2012-05-25,2.066667,Comedy,"Comedy, Drama, Romance",PG-13,John Madden,"Ol Parker (screenplay), Deborah Moggach (novel)","Judi Dench, Tom Wilkinson, Patrick Pearson, Hugh Dickson","English, Hindi","UK, USA, United Arab Emirates",62.0,7.3,84510,tt1412386,20th Century Fox,True,ok,48039108,139537943,10356908,0.706411698537683,7374223574556563673375775757777577536777777753434154455423233547546767277777765634575735166715755644166747600554437751343217772
620,The Big Lebowski,1998,1998-03-06,1.950000,Comedy,"Comedy, Crime",R,"Joel Coen, Ethan Coen","Ethan Coen, Joel Coen","Jeff Bridges, John Goodman, Julianne Moore, Steve Buscemi","English, German, Hebrew, Spanish","USA, UK",71.0,8.1,643769,tt0118715,Gramercy Pictures,False,notalk,25008106,66011004,21436985,0.926339285714286,76777777773434757777777774437777777777777777777777777777777565475777777767777777755777677777777765776777644557777777775777777771
622,The Blind Side,2009,2009-11-20,2.150000,Drama,"Biography, Drama, Sport",PG-13,John Lee Hancock,"John Lee Hancock, Michael Lewis (book)","Sandra Bullock, Tim McGraw, Quinton Aaron, Jae Head",English,USA,53.0,7.7,259889,tt0878804,Warner Bros. Pictures,False,men,277903289,331914441,38000606,0.505668934240363,017777643362571166443314223126300007610246673153343410001455734434202000045765345315665764754520033530357743475324477543451510
623,The Boondock Saints,1999,1999-11-19,1.800000,Action,"Action, Crime, Thriller",R,Troy Duffy,Troy Duffy,"Willem Dafoe, Sean Patrick Flanery, Norman Reedus, David Della Rocco","English, Spanish, Papiamento, Russian, Latin","USA, Canada",44.0,7.8,214193,tt0144117,Indican,False,nowomen,42613,575990,9789234,0.969486823855756,7777777777777777777777777777777777777777777777777777777667777757434777757777777777777777777777777777771
624,The Boondock Saints II: All Saints Day,2009,2009-12-11,1.966667,Action,"Action, Crime, Thriller",R,Troy Duffy,"Troy Duffy (screenplay), Troy Duffy (story), Taylor Duffy (story)","Sean Patrick Flanery, Norman Reedus, Billy Connolly, Clifton Collins Jr.","English, Italian, Spanish",USA,24.0,6.3,57839,tt1300851,Apparition Films,False,nowomen,11153924,11153924,8685853,0.794745484400657,777752432377777777665677752777547771377776447777567743105345467776544467535646777767477
625,The Bourne Identity,2002,2002-06-14,1.983333,Action,"Action, Mystery, Thriller",PG-13,Doug Liman,"Tony Gilroy (screenplay), W. Blake Herron (screenplay), Robert Ludlum (novel)","Matt Damon, Franka Potente, Chris Cooper, Clive Owen","English, French, German, Dutch, Italian","USA, Germany, Czech Republic",68.0,7.9,467233,tt0258463,Universal Pictures,False,notalk,157324072,276261727,77710753,0.746031746031746,777754477545744343543475476433357634434367477766745777775474433777367773
626,The Bourne Supremacy,2004,2004-07-23,1.800000,Action,"Action, Mystery, Thriller",PG-13,Paul Greengrass,"Robert Ludlum (novel), Tony Gilroy (screenplay)","Matt Damon, Franka Potente, Brian Cox, Julia Stiles","English, Russian, German, Italian","USA, Germany",73.0,7.8,400304,tt0372183,Universal Pictures,False,men,217149789,355883988,104821395,0.628180039138943,33543354655634443556451002577777647313525444434777756745443466347535353323354344474653445256553100457777764622352634443577765773552456535744444330
627,The Box,2009,2009-11-06,1.916667,Drama,"Drama, Fantasy, Mystery, Sci-Fi, Thriller",PG-13,Richard Kelly,"Richard Kelly (screenplay), Richard Matheson (short story ""Button","Button"""")""","Cameron Diaz, James Marsden, Frank Langella, James Rebhorn",English,USA,47.0,5.6,83814,tt0362478,Warner Bros. Pictures,True,ok,16342407,28600229,27143290,0.615902964959569
628,The Bridges of Madison County,1995,1995-06-02,2.250000,Drama,"Drama, Romance",PG-13,Clint Eastwood,"Richard LaGravenese (screenplay), Robert James Waller (novel)","Clint Eastwood, Meryl Streep, Annie Corley, Victor Slezak",English,USA,66.0,7.6,63860,tt0112579,Warner Bros. Pictures,True,ok,109333135,268326198,33633148,0.479452054794521,4332023434343443203433434334433434343434434344344333434443444344233434273
629,The Brothers Bloom,2008,2009-06-19,1.900000,Action,"Action, Adventure, Comedy, Crime, Drama, Romance",PG-13,Rian Johnson,Rian Johnson,"Rachel Weisz, Adrien Brody, Mark Ruffalo, Rinko Kikuchi","English, French, Czech, Japanese",USA,55.0,6.8,45839,tt0844286,Summit Entertainment,False,dubious,3822265,5986778,21645126,0.611344537815126,7777745777742777740022413457573240502675757623344445324467740020572377776467777157776200233253657623223056666674242554254065677101117510
630,The Bucket List,2007,2008-01-11,1.616667,Comedy,"Adventure, Comedy, Drama",PG-13,Rob Reiner,Justin Zackham,"Jack Nicholson, Morgan Freeman, Sean Hayes, Beverly Todd",English,USA,42.0,7.4,210180,tt0825232,Warner Bros. Pictures,False,notalk,105013679,195845194,50559457,0.897402597402597,77777777735537777755247777777766773357777777777777777754377675755677775777777777777777777777764155777745767773
631,The Butterfly Effect,2004,2004-01-23,1.883333,Drama,"Drama, Sci-Fi, Thriller",R,"Eric Bress, J. Mackye Gruber","J. Mackye Gruber, Eric Bress","Ashton Kutcher, Melora Walters, Amy Smart, Elden Henson",English,"USA, Canada",30.0,7.7,410901,tt0289879,New Line Cinema,False,men,71432302,118444284,16031507,0.704851752021563,53301655434663555674476575414465656534747656356434447773547754463445745766766657745243443666543654667776464320365525474464576367567342446664644556756536534355775356773554435654775775756764433443476643564476777551
632,The Cabin in the Woods,2011,2012-04-13,1.583333,Comedy,"Comedy, Horror",R,Drew Goddard,"Joss Whedon, Drew Goddard","Kristen Connolly, Chris Hemsworth, Anna Hutchison, Fran Kranz","English, Japanese",USA,72.0,7.0,330870,tt1259521,Lionsgate Films,False,dubious,43574905,73293915,31070724,0.641558441558442,7550246774355372354676223315654666763764356536646606231
633,The Cable Guy,1996,1996-06-14,1.600000,Comedy,"Comedy, Drama, Thriller",PG-13,Ben Stiller,Lou Holtz Jr.,"Jim Carrey, Matthew Broderick, Leslie Mann, Jack Black","English, French",USA,56.0,6.1,138458,tt0115798,Sony Pictures,False,notalk,89466773,152713266,69802752,0.864145658263305,776777577777557777747777744467676657777777764357767577757755453677647777773454667673456657777675557773
634,The Cell,2000,2000-08-18,1.783333,Horror/Thriller,"Horror, Sci-Fi, Thriller",R,Tarsem Singh,Mark Protosevich,"Jennifer Lopez, Colton James, Dylan Baker, Marianne Jean-Baptiste",English,"USA, Germany",40.0,6.3,88293,tt0209958,New Line Cinema,False,men,82907528,116230018,47351793,0.541071428571429,1301342000007777577777677145367523424174343343463522764333347214672352034604334213022420000177775777776770454666233332734334344635137552342562237714510355043342
635,"The Chronicles of Narnia: The Lion, the Witch and the Wardrobe",2005,2005-12-09,2.383333,Other,"Adventure, Family, Fantasy",PG,Andrew Adamson,"Ann Peacock (screenplay), Andrew Adamson (screenplay), Christopher Markus (screenplay), Stephen McFeely (screenplay), C.S. Lewis (book)","Georgie Henley, Skandar Keynes, William Moseley, Anna Popplewell","English, German, Brazilian Sign Language","USA, UK",75.0,6.9,331570,tt0363771,Buena Vista Pictures,True,ok,348020836,893351507,214745963,0.569642857142857,52424443444434455434324456764454243545255444226745424414454436544545532062455345
636,The Client,1994,1994-07-20,1.983333,Drama,"Crime, Drama, Mystery",PG-13,Joel Schumacher,"John Grisham (novel), Akiva Goldsman (screenplay), Robert Getchell (screenplay)","Susan Sarandon, Tommy Lee Jones, Mary-Louise Parker, Anthony LaPaglia",English,USA,65.0,6.7,53238,tt0109446,Warner Home Video,True,ok,144774225,184851675,70724911,0.400560224089636,677734756422510434731100711411241345630300014111000
639,The Crazies,2010,2010-02-26,1.683333,Horror/Thriller,"Horror, Thriller",R,Breck Eisner,"Scott Kosar (screenplay), Ray Wright (screenplay), George A. Romero","Timothy Olyphant, Radha Mitchell, Joe Anderson, Danielle Panabaker",English,"USA, United Arab Emirates",55.0,6.5,103011,tt0455407,Overture Films,True,ok,41793064,58705899,20296405,0.722567287784679,757750145246777774757544677777156647557646354264334456556755777545131
640,The Croods,2013,2013-03-22,1.633333,Action,"Animation, Action, Adventure, Comedy, Family, Fantasy",PG,"Kirk DeMicco, Chris Sanders","Chris Sanders (screenplay), Kirk DeMicco (screenplay), John Cleese (story), Kirk DeMicco (story), Chris Sanders (story)","Nicolas Cage, Emma Stone, Ryan Reynolds, Catherine Keener",English,USA,55.0,7.2,173278,tt0481499,20th Century Fox,False,men,187168425,573068425,135000000,0.669254658385093,05746462263445554346543325457564446534346453475644366773575565666544135745277777546447745620
641,The Crying Game,1992,1993-02-19,1.866667,Drama,"Crime, Drama, Romance, Thriller",R,Neil Jordan,Neil Jordan,"Forest Whitaker, Miranda Richardson, Stephen Rea, Adrian Dunbar",English,"UK, Japan, USA",90.0,7.3,46665,tt0104036,Live Home Video,False,men,103849232,103849232,6641389,0.934453781512605,644554547756767777777777777777777777736777667777777777777777777777777777777777777777777777777777777777777775324237644775767752447777777746777777777756776567777764455454775676777777777777777777777773677766777777777777777777777777777777777777777777777777777
642,The Curious Case of Benjamin Button,2008,2008-12-25,2.766667,Drama,"Drama, Fantasy, Romance",PG-13,David Fincher,"Eric Roth (screenplay), Eric Roth (story), Robin Swicord (story), F. Scott Fitzgerald (short story)","Cate Blanchett, Brad Pitt, Julia Ormond, Faune Chambers Watkins","English, Russian, French",USA,70.0,7.8,527517,tt0421715,Paramount Pictures,False,dubious,137997773,356938225,173161010,0.44472049689441,0013016222331267766777304100343527776317755034145374115310012777730420101577765222147777113101103420220331010232012
643,The Dark Knight,2008,2008-07-18,2.533333,Action,"Action, Crime, Drama, Thriller",PG-13,Christopher Nolan,"Jonathan Nolan (screenplay), Christopher Nolan (screenplay), Christopher Nolan (story), David S. Goyer (story), Bob Kane (characters)","Christian Bale, Heath Ledger, Aaron Eckhart, Michael Caine","English, Mandarin","USA, UK",84.0,9.0,2005606,tt0468569,Warner Bros. Pictures/Legendary,False,dubious,577216380,1085385502,200217418,0.866106442577031,777774576677755747777745354677777777777777745465776735764564577577773347754764336757777775744514777777776777777777767777046677777776777777777646757777466577776544447777777777777777346657766367545655775777624577457633377577777756454067777777767777777777677
644,The Dark Knight Rises,2012,2012-07-20,2.733333,Action,"Action, Thriller",PG-13,Christopher Nolan,"Jonathan Nolan (screenplay), Christopher Nolan (screenplay), Christopher Nolan (story), David S. Goyer (story), Bob Kane (characters)","Christian Bale, Gary Oldman, Tom Hardy, Joseph Gordon-Levitt","English, Arabic","UK, USA",78.0,8.4,1352041,tt1345836,Warner Bros. Pictures,False,notalk,454699213,1095143990,279025606,0.823732718894009,7776764367777743147777777477772234317777777675344477777765457777345623436765567757777777777557757777671337667677557567657746
646,The Deer Hunter,1978,1979-02-23,3.050000,Drama,"Drama, War",R,Michael Cimino,"Michael Cimino (story), Deric Washburn (story), Louis Garfinkle (story), Quinn K. Redeker (story), Deric Washburn (screenplay)","Robert De Niro, John Cazale, John Savage, Christopher Walken","English, Russian, Vietnamese, French","USA, UK",86.0,8.1,278676,tt0077416,Universal Pictures,False,notalk,178535299,178535299,53560590,0.896978021978022,77772577777345557777777777777777777777777777777426777777333437777777773417777547777777775477777777777764
647,The Departed,2006,2006-10-06,2.516667,Drama,"Crime, Drama, Thriller",R,Martin Scorsese,"William Monahan (screenplay), Alan Mak, Felix Chong","Leonardo DiCaprio, Matt Damon, Jack Nicholson, Mark Wahlberg","English, Cantonese","USA, Hong Kong",85.0,8.5,1044531,tt0407887,Warner Bros. Pictures,False,notalk,154080367,335803963,104021671,0.876750700280112,777775777777777747477776564373445777776777777777777777777753443453577777774434677773663467777777776334677777777467777777777777775747777777677444677777777777757777777776565777756544643467777767777777777777777777434434446777777734347777637534777777777753347
648,The Descent,2005,2006-08-04,1.650000,Horror/Thriller,"Adventure, Horror, Thriller",R,Neil Marshall,Neil Marshall,"Shauna Macdonald, Natalie Mendoza, Alex Reid, Saskia Mulder",English,UK,71.0,7.2,180679,tt0435625,Lionsgate Films,True,ok,31048038,68038213,8351232,0.0044642857142857,1100000000000000000000000000000000000000000000000000000000000000
649,The Devil Wears Prada,2006,2006-06-30,1.816667,Comedy,"Comedy, Drama",PG-13,David Frankel,"Aline Brosh McKenna (screenplay), Lauren Weisberger (novel)","Meryl Streep, Anne Hathaway, Emily Blunt, Stanley Tucci","English, French","USA, France",62.0,6.9,330051,tt0458352,20th Century Fox,True,ok,144174568,377426561,40452872,0.25944170771757,101000032142000003320012442155421241433102100100306250050024200004615225323154011320310
650,The Devil's Advocate,1997,1997-10-17,2.400000,Drama,"Drama, Mystery, Thriller",R,Taylor Hackford,"Andrew Neiderman (novel), Jonathan Lemkin (screenplay), Tony Gilroy (screenplay)","Keanu Reeves, Al Pacino, Charlize Theron, Jeffrey Jones","English, German, Italian, Mandarin, Spanish","USA, Germany",60.0,7.5,296076,tt0118971,Warner Home Video,True,ok,88536300,222050207,82720573,0.749579831932773,312576455446353565575333777777761265667777777622433434335366756771343437774777774147667465757753477777776634336763357776667777756776566530377544554544376377431677777773147467777777733333434343356774774243435776577777135757655675773457777777644433774427777
651,The Devil's Rejects,2005,2005-07-22,1.783333,Horror/Thriller,"Crime, Horror",R,Rob Zombie,"Rob Zombie, Rob Zombie (characters)","Sid Haig, Bill Moseley, Sheri Moon Zombie, William Forsythe","English, Spanish","USA, Germany",53.0,6.9,84774,tt0395584,Lionsgate Films,True,ok,20335227,24982624,8351232,0.757142857142857,775245451557774332335754655467766544277730057766554677677777677776777777015677757465654472
652,The English Patient,1996,1996-12-06,2.700000,Drama,"Drama, Romance, War",R,Anthony Minghella,"Michael Ondaatje (novel), Anthony Minghella (screenplay)","Ralph Fiennes, Juliette Binoche, Willem Dafoe, Kristin Scott Thomas","English, German, Italian, Arabic","USA, UK",87.0,7.4,162605,tt0116209,Miramax Films,True,ok,116906798,344137032,51980772,0.666149068322981,0423577525673620244355547223643377777743344422340356533436774442577675457555576777777657543404235775256736202443555472236433777777433444223403565334367744425776754575555767777776575434
653,The Exorcist,1973,1973-12-26,2.033333,Horror/Thriller,Horror,R,William Friedkin,"William Peter Blatty (written for the screen by), William Peter Blatty (novel)","Ellen Burstyn, Max von Sydow, Lee J. Cobb, Kitty Winn","English, Latin, Greek, French, German, Arabic, Kurdish",USA,82.0,8.0,324222,tt0070047,Warner Bros. Pictures,True,ok,1074306128,2111900435,62926730,0.500736377025037,7233321000066000000000501536543365410624633424004334677753221013434334654475445674777777777754012
654,The Expendables,2010,2010-08-13,1.716667,Action,"Action, Adventure, Thriller",R,Sylvester Stallone,"Dave Callaham (screenplay), Sylvester Stallone (screenplay), Dave Callaham (story)","Sylvester Stallone, Jason Statham, Jet Li, Dolph Lundgren","English, Spanish",USA,45.0,6.5,302289,tt1320253,Lionsgate Films,False,notalk,110101079,286572606,87595011,0.891855807743658,77777777777635545477777777777777777777777777776614643654434646467777774776777777777777775677667777755667673
655,The Expendables 2,2012,2012-08-17,1.716667,Action,"Action, Adventure, Thriller",R,Simon West,"Richard Wenk (screenplay), Sylvester Stallone (screenplay), Ken Kaufman (story), David Agosto (story), Richard Wenk (story), Dave Callaham (characters)","Sylvester Stallone, Jason Statham, Jet Li, Dolph Lundgren",English,"USA, Germany",51.0,6.6,272946,tt1764651,Lionsgate Films,True,ok,86272883,316546185,101463857,0.874200426439232,7777777777777777777765343577777776444554446577777577457367657776776
656,The Faculty,1998,1998-12-25,1.733333,Horror/Thriller,"Horror, Sci-Fi",R,Robert Rodriguez,"David Wechter (story), Bruce Kimmel (story), Kevin Williamson (screenplay)","Jordana Brewster, Clea DuVall, Laura Harris, Josh Hartnett",English,USA,61.0,6.5,101867,tt0133751,Miramax Films,False,dubious,57570196,57570196,21436985,0.337386018237082,12202554314007466001025240220133326453223201100
657,The Family,2013,2013-09-13,1.850000,Comedy,"Comedy, Crime, Thriller",R,Luc Besson,"Luc Besson (screenplay), Michael Caleo (screenplay), Tonino Benacquista (based on the book by)","Robert De Niro, Michelle Pfeiffer, Dianna Agron, John D'Leo","English, French, Italian","USA, France",42.0,6.3,100967,tt2404311,Relativity Media,False,men,36918811,51078541,30000000,0.731566820276498,3324544344755455677777733355677734543423337437777337776440034354577777726744576447777777775244777765433446777656564556375575
658,The Fast and the Furious,2001,2001-06-22,1.766667,Action,"Action, Crime, Thriller",PG-13,Rob Cohen,"Ken Li (magazine article ""Racer X"""")",Gary Scott Thompson (screen story),Gary Scott Thompson (screenplay),Erik Bergquist (screenplay),"David Ayer (screenplay)""","Paul Walker, Vin Diesel, Michelle Rodriguez, Jordana Brewster","English, Spanish","USA, Germany",58.0,6.8,313463,tt0232500,Universal Pictures,False,notalk,190155939
659,The Fifth Element,1997,1997-05-09,2.100000,Action,"Action, Adventure, Sci-Fi",PG-13,Luc Besson,"Luc Besson (screenplay by), Robert Mark Kamen (screenplay by), Luc Besson (story by)","Bruce Willis, Gary Oldman, Ian Holm, Milla Jovovich","English, Swedish, German, Arabic, Egyptian (Ancient)",France,52.0,7.7,392404,tt0119116,Sony Pictures,False,notalk,92256459,382981741,137867622,0.900246305418719,77777777777777777777777656477755777666676777777777777776777674756475764434667577763576754457767767777775677757753567
660,The Fifth Estate,2013,2013-10-18,2.133333,Drama,"Biography, Drama, Thriller",R,Bill Condon,"Daniel Domscheit-Berg (book), David Leigh (book), Luke Harding (book), Josh Singer (screenplay by)","Peter Capaldi, David Thewlis, Anatole Taubman, Alexander Beyer","English, Icelandic, Swahili, Arabic","USA, India, Belgium",49.0,6.2,35464,tt1837703,Walt Disney Pictures,False,notalk,3254172,6154172,26000000,0.833122629582807,73634776777777777777574675347777777774477777544433736757733760254577742677777753765733777777775757777755757547774
661,The Fighter,2010,2010-12-17,1.933333,Drama,"Biography, Drama, Sport",R,David O. Russell,"Scott Silver (screenplay), Paul Tamasy (screenplay), Eric Johnson (screenplay), Paul Tamasy (story), Eric Johnson (story), Keith Dorrington (story)","Mark Wahlberg, Christian Bale, Amy Adams, Melissa Leo",English,USA,79.0,7.8,309668,tt0964517,Paramount Pictures,False,men,100004670,138082199,11750550,0.660349854227405,76525643354345777654337676756767766654324343330135232676365243736554621226775544577433455734656661
662,The Fog,2005,2005-10-14,1.666667,Horror/Thriller,Horror,PG-13,Rupert Wainwright,"Cooper Layne (screenplay), John Carpenter, Debra Hill","Tom Welling, Maggie Grace, Selma Blair, DeRay Davis",English,USA,27.0,3.6,32511,tt0432291,Sony Pictures Classics,True,ok,35207734,44200119,21474596,0.482539682539683,643222242646512015454433343533641126501345562
663,The Fourth Kind,2009,2009-11-06,1.633333,Horror/Thriller,"Mystery, Sci-Fi, Thriller",PG-13,Olatunde Osunsanmi,"Olatunde Osunsanmi (screenplay), Olatunde Osunsanmi (story), Terry Robbins (story)","Milla Jovovich, Will Patton, Hakeem Kae-Kazim, Corey Johnson","English, Aboriginal","USA, UK",34.0,5.9,69129,tt1220198,Universal Pictures,True,ok,28465896,53729463,10857316,0.481049562682216,54423511343300134313341442752444434122325543320101355667133552331435654226654455523453312334466541
664,The French Connection,1971,1971-10-09,1.733333,Action,"Action, Crime, Drama, Thriller",R,William Friedkin,"Ernest Tidyman (screenplay by), Robin Moore (based on the book by)","Gene Hackman, Fernando Rey, Roy Scheider, Tony Lo Bianco","English, French",USA,96.0,7.8,96859,tt0067116,20th Century Fox,False,notalk,236848653,236848653,12659931,0.942028985507246,777777776357777777777777774645646777767777777777775777777477777777777777777775457777777777777774636547777767777777777775777776577777777775
665,The Fugitive,1993,1993-08-06,2.166667,Action,"Action, Crime, Drama, Mystery, Thriller",PG-13,Andrew Davis,"Jeb Stuart (screenplay), David Twohy (screenplay), David Twohy (story), Roy Huggins (characters)","Harrison Ford, Tommy Lee Jones, Sela Ward, Julianne Moore","English, Polish, Spanish",USA,87.0,7.8,239806,tt0106977,Warner Bros. Pictures,False,men,296492106,570351412,70948192,0.868071818891491,776347763777577777777766764766747777776677764533353374777757767777655767427646767777777777777733777367757777777776676566674777777667777354235436477775776777765576743664676777777777772
666,The Game,1997,1997-09-12,2.150000,Drama,"Drama, Mystery, Thriller",R,David Fincher,"John Brancato, Michael Ferris","Michael Douglas, Sean Penn, Deborah Kara Unger, James Rebhorn","English, Cantonese, German",USA,61.0,7.8,308573,tt0119174,Universal Pictures,False,notalk,70044851,70044851,72561906,0.722878625134264,5634777777667443447777677777776477773245355433434454333434433677557775647777777774434433323313245527777756557777776442433344564764342
668,The Godfather,1972,1972-03-24,2.916667,Drama,"Crime, Drama",R,Francis Ford Coppola,"Mario Puzo (screenplay by), Francis Ford Coppola (screenplay by), Mario Puzo (based on the novel by)","Marlon Brando, Al Pacino, James Caan, Richard S. Castellano","English, Italian, Latin",USA,100.0,9.2,1397893,tt0068646,Paramount Pictures,False,notalk,752051643,1496119403,39004975,0.872491145218418,7776775534447766777777777635764666775767777777777773664446777777777776442375355777777777777777777777337777777277766777133
669,The Godfather: Part II,1974,1974-12-20,3.366667,Drama,"Crime, Drama",R,Francis Ford Coppola,"Francis Ford Coppola (screenplay by), Mario Puzo (screenplay by), Mario Puzo (based on the novel by)","Al Pacino, Robert Duvall, Diane Keaton, Robert De Niro","English, Italian, Spanish, Latin, Sicilian",USA,90.0,9.0,965569,tt0071562,Paramount Pictures,True,ok,270669505,270669505,61408439,0.844897959183673,77612312757775467644677336776256777777777777777655777755436777776677774567772377777777777777774677777777777377777777754433532577777765154672
671,The Great Gatsby,2013,2013-05-10,2.383333,Drama,"Drama, Romance",PG-13,Baz Luhrmann,"Baz Luhrmann (screenplay), Craig Pearce (screenplay), F. Scott Fitzgerald (based on the novel by)","Lisa Adam, Frank Aldridge, Amitabh Bachchan, Steve Bisley",English,"Australia, USA",55.0,7.3,423309,tt1343092,Warner Bros. Pictures,False,dubious,144840419,351040419,190000000,0.790816326530612,77777774433163352777654254236774644566435777777777777531125777773456765535355577755474656677777677435465665574445775756777577777777776677365
672,The Green Mile,1999,1999-12-10,3.150000,Drama,"Crime, Drama, Fantasy, Mystery",R,Frank Darabont,"Stephen King (novel), Frank Darabont (screenplay)","Tom Hanks, David Morse, Bonnie Hunt, Michael Clarke Duncan","English, French",USA,61.0,8.5,974980,tt0120689,Warner Bros. Pictures,False,notalk,191311527,406534833,83907722,0.89344262295082,73357777777677774367777777777777777777667777535767677777777777777777777777665567777777777766254467777775443367777556544356
673,The Grey,2011,2012-01-27,1.950000,Action,"Action, Adventure, Drama, Thriller",R,Joe Carnahan,"Joe Carnahan (screenplay), Ian Mackenzie Jeffers (screenplay), Ian Mackenzie Jeffers (short story ""Ghost Walker"""")""","Liam Neeson, Frank Grillo, Dermot Mulroney, Dallas Roberts","English, Spanish",USA,64.0,6.8,225033,tt1601913,Open Road Films,False,nowomen,52335195,85574308,25365964,0.993855606758833,777777777777777777777777777777777777777777777777777777777777777777777777777777777777777777773
674,The Grudge,2004,2004-10-22,1.516667,Horror/Thriller,"Horror, Mystery, Thriller",PG-13,Takashi Shimizu,"Stephen Susco (screenplay), Takashi Shimizu (film ""Ju-On: The Grudge"""")""","Sarah Michelle Gellar, Jason Behr, William Mapother, Clea DuVall","English, Japanese","USA, Japan",49.0,5.9,128591,tt0391198,Sony Pictures,True,ok,136094379,230953737,12331929,0.388198757763975,23346010000001117777153443276644323000000372333335401000000212777623533436755331300000057141
675,The Guard,2011,2011-07-07,1.600000,Comedy,"Comedy, Crime, Thriller",R,John Michael McDonagh,John Michael McDonagh,"Ronan Collins, Paraic Nialand, John Patrick Beirne, Liam O'Conghaile","English, Irish",Ireland,78.0,7.3,74015,tt1540133,Sony Pictures Classics,False,notalk,5551069,16513705,6214145,0.893203883495146,7777777715777777777777777777777745567774665443567777777777777763346467556777773533677777777775777777775
