csvbase_row_id,title,year,release_date,runtime,genre5,genre_detailed,rated,director,writer,actors,language,country,metascore,imdb_rating,imdb_votes,imdb_id,studio,bechdel_binary,bechdel_ordinal,us_gross,int_gross,budget,men_lines,lines_data
381,Lord of War,2005,2005-09-16,2.033333,Drama,"Crime, Drama, Thriller",R,Andrew Niccol,Andrew Niccol,"Nicolas Cage, Bridget Moynahan, Jared Leto, Shake Tukhmanyan","English, Ukrainian, German, Spanish, Russian, French, Arabic, Turkish","USA, Germany, France",62.0,7.6,273636,tt0399295,Lionsgate Films,False,men,28811311,74138215,50107391,0.880466472303207,7675773767777777777777777774554473477677777777777777434734775575677777777777543337654467777776777776667647677777777777777777736544635767777777777777774257257746666777777777774442466644677777767775
382,Lost in Space,1998,1998-04-03,2.166667,Action,"Action, Adventure, Family, Sci-Fi, Thriller",PG-13,Stephen Hopkins,"Irwin Allen (television series), Akiva Goldsman","William Hurt, Mimi Rogers, Heather Graham, Lacey Chabert",English,USA,42.0,5.1,65551,tt0120738,New Line Home Entertainment,True,ok,98778237,194429617,114330585,0.765133171912833,7777634477777556257777424576355647536766537756645665464666475677647474045534443766547447537705777775773777456554677252
383,Lost in Translation,2003,2003-10-03,1.700000,Drama,Drama,R,Sofia Coppola,Sofia Coppola,"Scarlett Johansson, Bill Murray, Akiko Takeshita, Kazuyoshi Minamimagoe","English, Japanese, German, French","USA, Japan",89.0,7.8,365884,tt0335266,Focus Features,False,dubious,56449060,142498954,5064348,0.504761904761905,753255334323432343245243215334343433437346734332443342345441
384,Love & Basketball,2000,2000-04-21,2.066667,Drama,"Drama, Romance, Sport",PG-13,Gina Prince-Bythewood,Gina Prince-Bythewood,"Glenndon Chatman, Jess Willard, Chris Warren, Kyla Pratt","English, Spanish",USA,70.0,7.2,16302,tt0199725,New Line Cinema,True,ok,37125324,37488584,20293626,0.44015444015444,7765545552033431033454332132067443334344320000003024445433444500441025453777764444325001344103257754301434430000457743434322000000433434434013434251
385,Love & Other Drugs,2010,2010-11-24,1.866667,Comedy,"Comedy, Drama, Romance",R,Edward Zwick,"Charles Randolph (screenplay), Edward Zwick (screenplay), Marshall Herskovitz (screenplay), Jamie Reidy (book)","Jake Gyllenhaal, Anne Hathaway, Oliver Platt, Hank Azaria",English,USA,55.0,6.7,164270,tt0758752,20th Century Fox,False,men,34575465,109728398,32046955,0.632218844984802,6443372357734575734364764424673133523331412357777643324634644343335565674557144456375377745363
388,Made in Dagenham,2010,2010-09-20,1.883333,Comedy,"Biography, Comedy, Drama, History",R,Nigel Cole,William Ivory,"Sally Hawkins, Andrea Riseborough, Jaime Winstone, Lorraine Stanley",English,UK,65.0,7.2,12847,tt1371155,Sony Pictures Classics,True,ok,1170108,16711628,8545855,0.352380952380952,143223410440023565141033013453014410137627431115653421172005125524343000003300236100364303244142234010110
389,Magnolia,1999,2000-01-07,3.133333,Drama,Drama,R,Paul Thomas Anderson,Paul Thomas Anderson,"Pat Healy, Genevieve Zweig, Mark Flanagan, Neil Flynn","English, German, French",USA,77.0,8.0,265792,tt0175880,New Line Cinema,False,notalk,31396836,67751013,51743095,0.750140056022409,777777677675534434344677777756565535674345577773777777646434421343544454434775453434576537777776676734444254777766434344634434636776334335535777545546544677666777776343433644433643455343577777776777777767767553443434467777775656553567434557777377777764643
390,Major League,1989,1989-04-07,1.783333,Comedy,"Comedy, Sport",R,David S. Ward,David S. Ward,"Tom Berenger, Charlie Sheen, Corbin Bernsen, Margaret Whitton","English, Spanish, Japanese",USA,62.0,7.2,55270,tt0097815,Paramount Pictures,False,notalk,93590469,93590469,20675477,0.817245817245817,523433677777777777777777777767733377577776534344577743676665577777776564474344344337777777767762433447767777776533333777777777777777777777767633477577776533444577733775756577777775663573443443347777777677761443357767777775
391,Malcolm X,1992,1992-11-18,3.366667,Drama,"Biography, Drama, History, Romance",PG-13,Spike Lee,"Alex Haley (book), Malcolm X (book), Arnold Perl (screenplay), Spike Lee (screenplay)","Denzel Washington, Angela Bassett, Albert Hall, Al Freeman Jr.",English,"USA, Japan",72.0,7.7,73456,tt0104797,Warner Bros. Pictures,False,dubious,79978777,79978777,58112153,0.822916666666667,776535725330177777777775437777665677473777777777777777777745343437777444677776434376776577547773
392,Mallrats,1995,1995-10-20,1.566667,Comedy,"Comedy, Romance",R,Kevin Smith,Kevin Smith,"Shannen Doherty, Jeremy London, Jason Lee, Claire Forlani",English,USA,41.0,7.2,107637,tt0113749,MCA Universal Home Video,False,notalk,3223228,3223228,9325555,0.865546218487395,676554777746776767754767675417777777777776474637765
393,Margaret,2011,2012-06-01,2.500000,Drama,Drama,R,Kenneth Lonergan,Kenneth Lonergan,"Anna Paquin, J. Smith-Cameron, Mark Ruffalo, Jeannie Berlin",English,USA,61.0,6.5,14503,tt0466893,Fox Searchlight Pictures,True,ok,48869,48869,14499671,0.320754716981132,42254344343210032235401234135143510415241342303044240000000332432342342342433471351000000376652333300000000002000130134133331000333353233524425454343000023000000000202232252230461333333345052013021354233321132300
394,Margin Call,2011,2011-09-29,1.783333,Drama,"Drama, Thriller",R,J.C. Chandor,J.C. Chandor,"Kevin Spacey, Paul Bettany, Jeremy Irons, Zachary Quinto",English,USA,76.0,7.1,105497,tt1615147,Roadside Attractions,False,notalk,5544660,18510079,3521349,0.892354124748491,7332257777777677777777777777777777777777777777775576775777757567777535366777777777767777743777654577744577777777777777777777777754424677763340
396,Mars Attacks!,1996,1996-12-13,1.766667,Comedy,"Comedy, Sci-Fi",PG-13,Tim Burton,"Len Brown (trading card series), Woody Gelman (trading card series), Wally Wood (trading card series), Bob Powell (trading card series), Norman Saunders (trading card series), Jonathan Gems (screen story), Jonathan Gems (screenplay)","Jack Nicholson, Glenn Close, Annette Bening, Pierce Brosnan","English, French",USA,52.0,6.3,192594,tt0116996,Warner Home Video,True,ok,56096190,150552679,118813194,0.754098360655738,7732437663647443565456754566645575677476774636757676575545254
397,Martha Marcy May Marlene,2011,2011-12-21,1.700000,Drama,"Drama, Mystery, Thriller",R,Sean Durkin,Sean Durkin,"Elizabeth Olsen, Christopher Abbott, Brady Corbet, Hugh Dancy",English,USA,75.0,6.9,45226,tt1441326,Fox Searchlight Pictures,True,ok,3087434,3657064,1035691,0.273584905660377,0005520000242221024410351241002200130344344310232000000033000020000004431456534355223016760422202234000002
398,Master and Commander: The Far Side of the World,2003,2003-11-14,2.300000,Action,"Action, Adventure, Drama, History, War",PG-13,Peter Weir,"Patrick O'Brian (novels), Peter Weir (screenplay), John Collee (screenplay)","Russell Crowe, Paul Bettany, James D'Arcy, Edward Woodall","English, French, Portuguese",USA,81.0,7.4,186992,tt0311113,20th Century Fox,False,nowomen,118918972,269565280,170921739,1.0,77777777777777777777777777777777777777777777777777777777777777777777777777777777777
399,Match Point,2005,2006-01-20,2.066667,Drama,"Drama, Romance, Thriller",R,Woody Allen,Woody Allen,"Jonathan Rhys Meyers, Alexander Armstrong, Paul Kaye, Matthew Goode",English,"UK, Ireland, Luxembourg",72.0,7.6,187997,tt0416320,Dream Works,True,ok,27547047,104974897,17895497,0.568552253116012,77777756455435355512343444434345753452322234356514334677612644763016344103333233255554334443235242434774233234433342323524754567742201232777774774452
400,Max Payne,2008,2008-10-17,1.666667,Action,"Action, Crime, Drama, Mystery, Thriller",PG-13,John Moore,"Beau Thorne (screenplay), Sam Lake (video game by Remedy Entertainment and 3-D Realms Entertainment)","Mark Wahlberg, Mila Kunis, Beau Bridges, Ludacris","English, Russian, Spanish","Canada, USA",31.0,5.4,116422,tt0467197,20th Century Fox,True,ok,44034081,92816237,37878971,0.81453634085213,771754357777457775434534677247777777777777537777776644364
401,Mean Girls,2004,2004-04-30,1.616667,Comedy,Comedy,PG-13,Mark Waters,"Rosalind Wiseman (book), Tina Fey (screenplay)","Lindsay Lohan, Rachel McAdams, Tina Fey, Tim Meadows","English, German, Vietnamese, Swahili","USA, Canada",66.0,7.0,292241,tt0377092,Paramount Pictures,True,ok,106112827,161490339,22197472,0.17039586919105,00223222101020000000000112112242100011201310012533000000010102134350230000224211230
402,Memento,2000,2001-05-25,1.883333,Horror/Thriller,"Mystery, Thriller",R,Christopher Nolan,"Christopher Nolan (screenplay), Jonathan Nolan (short story ""Memento Mori"""")""","Guy Pearce, Carrie-Anne Moss, Joe Pantoliano, Mark Boone Junior",English,USA,80.0,8.5,1007888,tt0209144,Newmarket Film Group,False,notalk,34559865,53741710,6764542,0.802608180201541,7777777777777743233367777677777643763341437777777777774775655777777774344435543433115563434341465667777777777777667777777777777777777753233357777677777743673342336777777777775675745777777775344434643433124464434341456567777777777777757777774
403,Memoirs of a Geisha,2005,2005-12-23,2.416667,Drama,"Drama, Romance",PG-13,Rob Marshall,"Robin Swicord (screenplay), Arthur Golden (book)","Suzuka Ohgo, Togo Igawa, Mako, Samantha Futerman","English, Japanese",USA,54.0,7.4,130025,tt0397535,Sony Pictures,True,ok,68015836,192687798,101407816,0.332361516034985,7350000000075200022333310254101455144343540133330
404,Men in Black,1997,1997-07-02,1.633333,Comedy,"Adventure, Comedy, Mystery, Sci-Fi",PG-13,Barry Sonnenfeld,"Lowell Cunningham (comic), Ed Solomon (screen story), Ed Solomon (screenplay)","Tommy Lee Jones, Will Smith, Linda Fiorentino, Vincent D'Onofrio","English, Spanish",USA,71.0,7.3,465696,tt0119654,Columbia TriStar International,False,notalk,363811668,853024040,130611431,0.888736263736264,77777777777377777777777647777777777777777777776357777512334725567777777777777377633447667776775777777661
405,Men in Black 3,2012,2012-05-25,1.766667,Action,"Action, Adventure, Comedy, Sci-Fi",PG-13,Barry Sonnenfeld,"Etan Cohen, Lowell Cunningham (based on the Malibu comic by)","Will Smith, Tommy Lee Jones, Josh Brolin, Jemaine Clement","English, Ukrainian",USA,58.0,6.8,301820,tt1409024,Sony Pictures,False,notalk,181641463,633967639,218147292,0.982507288629738,77777777777777777777777777776677777777777777777777777777557777777777777777777777777777777777777771
406,Michael Clayton,2007,2007-10-12,1.983333,Drama,"Crime, Drama, Mystery, Thriller",R,Tony Gilroy,Tony Gilroy,"Tom Wilkinson, Michael O'Keefe, Sydney Pollack, Danielle Skraastad",English,USA,82.0,7.3,147251,tt0465538,Warner Bros. Pictures,False,men,55091699,104475669,24156185,0.814449917898194,777777777777775612773305574345266677773466777777733577747777765677537777777777153344573
407,Midnight in Paris,2011,2011-06-10,1.566667,Comedy,"Comedy, Fantasy, Romance",PG-13,Woody Allen,Woody Allen,"Owen Wilson, Rachel McAdams, Kurt Fuller, Mimi Kennedy","English, French, Spanish, German","Spain, USA, France",81.0,7.7,349394,tt1605783,Sony Pictures Classics,True,ok,58844493,160342190,31070724,0.573957016434892,44444533433334036346335565576457777773323357633243433244523454432424567737742336244222335236642255554343434334441
408,Milk,2008,2009-01-30,2.133333,Drama,"Biography, Drama",R,Gus Van Sant,Dustin Lance Black,"Sean Penn, Emile Hirsch, Josh Brolin, Diego Luna",English,USA,84.0,7.6,152876,tt1013753,Focus Features,False,notalk,34460447,62006112,21645126,0.965909090909091,6677777777777777777777777777777777777777764567777766777776777766776776767776677777776776
409,Million Dollar Baby,2004,2005-01-28,2.200000,Drama,"Drama, Sport",PG-13,Clint Eastwood,"Paul Haggis (screenplay), F.X. Toole (stories)","Clint Eastwood, Hilary Swank, Morgan Freeman, Jay Baruchel","English, Irish",USA,86.0,8.1,574434,tt0405159,Warner Bros. Pictures,True,ok,123926269,286120974,36995786,0.793197278911565,775677777777765765476757477767777545667734767667446757664775664635547520006777567665464665345563224677773
410,Minority Report,2002,2002-06-21,2.416667,Action,"Action, Crime, Mystery, Sci-Fi, Thriller",PG-13,Steven Spielberg,"Philip K. Dick (short story), Scott Frank (screenplay), Jon Cohen (screenplay)","Tom Cruise, Max von Sydow, Steve Harris, Neal McDonough","English, Swedish",USA,80.0,7.7,460299,tt0181689,Dream Works,False,notalk,170995666,464742312,132108280,0.808114961961116,6474777766567655667777777777777776777777774777577676777777767621424334342476773453457763537777776777326777777656323357455576766757523577775344313477776453437566774477765
413,Moneyball,2011,2011-09-23,2.216667,Drama,"Biography, Drama, Sport",PG-13,Bennett Miller,"Steven Zaillian (screenplay), Aaron Sorkin (screenplay), Stan Chervin (story), Michael Lewis (book)","Brad Pitt, Jonah Hill, Philip Seymour Hoffman, Robin Wright",English,USA,87.0,7.6,319639,tt1210166,Sony Pictures,False,notalk,78303911,115142275,51784539,0.935666982024598,7326674344777775677777777777777777777777777777777777776776775467777777774777777754546777777777777777777777777777777777777777767545777767364777777777775
414,Monkeybone,2001,2001-02-23,1.550000,Comedy,"Animation, Comedy, Fantasy",PG-13,Henry Selick,"Kaja Blackley (graphic novel ""Dark Town"""")","Sam Hamm""","Brendan Fraser, Bridget Fonda, John Turturro, Chris Kattan",English,USA,40.0,4.7,15607,tt0166276,20th Century Fox,False,dubious,7118091,7118091,98688447,0.649769585253456
415,Monster House,2006,2006-07-21,1.516667,Comedy,"Animation, Adventure, Comedy, Family, Fantasy, Mystery",PG,Gil Kenan,"Dan Harmon (screenplay), Rob Schrab (screenplay), Pamela Pettler (screenplay), Dan Harmon (story), Rob Schrab (story)","Ryan Newman, Steve Buscemi, Mitchel Musso, Catherine O'Hara",English,USA,68.0,6.6,87058,tt0385880,Sony Pictures,True,ok,85137126,163276310,86684726,0.7125,66575777776346555467700035452364664255254443575564655455354665667767675756764543
416,"Monsters, Inc.",2001,2001-11-02,1.533333,Comedy,"Animation, Adventure, Comedy, Family, Fantasy",G,"Pete Docter, David Silverman(co-director), Lee Unkrich(co-director)","Pete Docter (original story by), Jill Culton (original story by), Jeff Pidgeon (original story by), Ralph Eggleston (original story by), Andrew Stanton (screenplay by), Daniel Gerson (screenplay by), Bob Peterson (additional story material), David Silverman (additional story material), Joe Ranft (additional story material), Robert L. Baird (additional screenplay material), Rhett Reese (additional screenplay material), Jonathan Roberts (additional screenplay material)","John Goodman, Billy Crystal, Mary Gibbs, Steve Buscemi",English,USA,78.0,8.1,718325,tt0198781,Buena Vista Distribution Compa,False,notalk,380836644,736554932,151322285,0.922206506364922,07777777753677677577777775744576677777777777777777746776767766777775777777757773677777777777777647655
417,Moon,2009,2009-07-10,1.616667,Drama,"Drama, Mystery, Sci-Fi",R,Duncan Jones,"Duncan Jones (story), Nathan Parker","Sam Rockwell, Kevin Spacey, Dominique McElligott, Rosie Shaw","English, Spanish","UK, USA",67.0,7.9,305780,tt1182345,Sony Pictures Classics,False,notalk,5439692,11591350,5428658,0.915178571428571,7777777776067777777677777777466677777777732777777767777777747660
418,Moonrise Kingdom,2012,2012-06-29,1.566667,Comedy,"Adventure, Comedy, Drama, Romance",PG-13,Wes Anderson,"Wes Anderson, Roman Coppola","Bruce Willis, Edward Norton, Bill Murray, Frances McDormand",English,USA,84.0,7.8,284483,tt1748122,Focus Features,True,ok,46178703,64949517,16234217,0.7296918767507,777777477777562464445544441466544455754356754543442642533440477775466443776656777775777754354546445675
420,Mr. & Mrs. Smith,2005,2005-06-10,2.000000,Action,"Action, Comedy, Crime, Thriller",PG-13,Doug Liman,Simon Kinberg,"Brad Pitt, Angelina Jolie, Vince Vaughn, Adam Brody","English, Spanish",USA,55.0,6.5,404756,tt0356910,20th Century Fox,False,men,222305354,570671028,131233644,0.528571428571429,4443373245125561134755464443344344012545
421,Mulan,1998,1998-06-19,1.466667,Other,"Animation, Adventure, Family, Fantasy, Musical, War",G,"Tony Bancroft, Barry Cook","Robert D. San Souci (based on a story by), Rita Hsiao (screenplay by), Chris Sanders (screenplay by), Philip LaZebnik (screenplay by), Raymond Singer (screenplay by), Eugenia Bostwick-Singer (screenplay by), Dean DeBlois (story co-head), John Sanford (story), Chris Williams (story), Tim Hodge (story), Julius Aguimatang (story), Burny Mattinson (story), Lorna Cook (story), Barry Johnson (story), Thom Enriquez (story), Ed Gombert (story), Joe Grant (story), Floyd Norman (story), Linda Woolverton (additional story material), Jodi Ann Johnson (additional story material), Alan Ormsby (additional story material), David Reynolds (additional story material), Don Dougherty (additional story material), Jorgen Klubien (additional story material), Denis Rich (additional story material), Joe Ekers (additional story material), Theodore Newton (additional story material), Larry Scholl (additional story material), Daan Jippes (additional story material), Frank Nissen (additional story material), Jeff Snow (additional story material)","Miguel Ferrer, Harvey Fierstein, Freda Foh Shen, June Foray","English, Mandarin",USA,71.0,7.6,213920,tt0120762,Buena Vista Pictures,False,dubious,172382303,433741657,128621908,0.714285714285714,5632000353577777344767745454677645466476666766546544355565576546474400014536777754457676445547766545565667577574465433656556755461
422,Mulholland Drive,2001,2001-10-19,2.450000,Drama,"Drama, Mystery, Thriller",R,David Lynch,David Lynch,"Naomi Watts, Jeanne Bates, Dan Birnbaum, Laura Harring","English, Spanish","France, USA",83.0,8.0,284216,tt0166924,Universal Focus,True,ok,9499853,15684329,19737689,0.423076923076923,777210013101777777401776460234003200021026343677772000000002446443535740000021776300013102777777302776450243003200030035434677771000000002546433536730000020
424,My Best Friend's Wedding,1997,1997-06-20,1.750000,Comedy,"Comedy, Drama, Romance",PG-13,P.J. Hogan,Ronald Bass,"Julia Roberts, Dermot Mulroney, Cameron Diaz, Rupert Everett","English, French, Italian",USA,50.0,6.3,114014,tt0119738,Sony Pictures,False,men,184036082,433809062,66756954,0.298800436205016,02000045451000000021000000025444431222310000000006514343220354344510000002612354744203410225644244430013101443330015142643200027510
425,My Big Fat Greek Wedding,2002,2002-08-02,1.583333,Comedy,"Comedy, Drama, Romance",PG,Joel Zwick,Nia Vardalos,"Nia Vardalos, Michael Constantine, Christina Eleusiniotis, Kaylee Vieira","English, Greek","Canada, USA",62.0,6.6,112196,tt0259446,IFC Films,True,ok,312705749,456217193,6475896,0.395989974937343,134022332247321123501544430421142332563425322326510156211
426,My Bloody Valentine,2009,2009-01-16,1.683333,Horror/Thriller,"Horror, Mystery, Thriller",R,Patrick Lussier,"Todd Farmer (screenplay), Zane Smith (screenplay), John Beaird, Stephen A. Miller","Jensen Ackles, Jaime King, Kerr Smith, Betsy Rue",English,USA,51.0,5.5,50082,tt1179891,Lionsgate Films,False,men,55965069,111564348,15200242,0.662131519274377,767541554204723674477757654457757677576650010046554475333636552
427,My Cousin Vinny,1992,1992-03-13,2.000000,Comedy,"Comedy, Crime",R,Jonathan Lynn,Dale Launer,"Joe Pesci, Ralph Macchio, Marisa Tomei, Mitchell Whitfield",English,USA,68.0,7.6,94297,tt0104952,20th Century Fox,False,notalk,87880798,87880798,18263820,0.875576036866359,7777677676657664466777767755771
428,Mystery Men,1999,1999-08-06,2.016667,Action,"Action, Comedy, Fantasy, Sci-Fi",PG-13,Kinka Usher,"Neil Cuthbert, Bob Burden (comic book series)","Hank Azaria, Janeane Garofalo, William H. Macy, Kel Mitchell",English,USA,65.0,6.1,57956,tt0132347,Universal Pictures,False,nowomen,41621042,46795352,95095418,0.80672268907563,777777545754677777766766777777767742465766566764366667555333476677556746635563335655444677576546766656777777446663777777757757777777677732556766557754375767455332676677466655635653336555445677566556757562
429,Mystic River,2003,2003-10-15,2.300000,Drama,"Crime, Drama, Mystery, Thriller",R,Clint Eastwood,"Brian Helgeland (screenplay), Dennis Lehane (novel)","Sean Penn, Tim Robbins, Kevin Bacon, Laurence Fishburne",English,"USA, Australia",84.0,8.0,381106,tt0327056,WB,True,ok,114118990,198566990,37982609,0.866746698679472,77777734675454777777457777464776667335755677754547557777777777732756777453667777777777777763477777777777777777777776400
430,Nebraska,2013,2014-01-24,1.916667,Comedy,"Adventure, Comedy, Drama",R,Alexander Payne,Bob Nelson,"Bruce Dern, Will Forte, June Squibb, Bob Odenkirk","English, Spanish",USA,86.0,7.7,103428,tt1821549,Paramount Pictures,True,ok,17482517,17482517,12000000,0.788018433179724,7567566476776674477777777775364665577754767777777646777632337734233323547634750776254656653246677646372637777777777754366774
431,Network,1976,1976-11-27,2.016667,Drama,Drama,R,Sidney Lumet,Paddy Chayefsky,"Faye Dunaway, William Holden, Peter Finch, Robert Duvall",English,USA,88.0,8.1,128019,tt0074958,MGM/United Artists,True,ok,96934884,96934884,15548943,0.911468812877264,77755653776667777775766677447777777777777777776676337777763777777777774
432,Never Let Me Go,2010,2010-10-15,1.716667,Drama,"Drama, Romance, Sci-Fi",R,Mark Romanek,"Kazuo Ishiguro (novel), Alex Garland (screenplay)","Carey Mulligan, Andrew Garfield, Izzy Meikle-Small, Charlie Rowe",English,"UK, USA",69.0,7.2,128054,tt1334260,Fox Searchlight Pictures,True,ok,2600773,12294827,16023478,0.214285714285714,100010240243000001210000005300000014300152445303543130000000032511431224431010
433,New York Minute,2004,2004-05-07,1.516667,Comedy,"Comedy, Crime, Family, Romance",PG,Dennie Gordon,"Emily Fox (story), Emily Fox (screenplay), Adam Cooper (screenplay), Bill Collage (screenplay)","Ashley Olsen, Mary-Kate Olsen, Eugene Levy, Andy Richter",English,USA,33.0,4.9,20018,tt0363282,Warner Bros. Pictures,False,notalk,17287347,26163275,49327715,0.329493087557604,03202000522234002351000001573277040054112006014323723433235313
434,Nick and Norah's Infinite Playlist,2008,2008-10-03,1.500000,Comedy,"Comedy, Drama, Music, Romance",PG-13,Peter Sollett,"Lorene Scafaria (screenplay), Rachel Cohn (novel), David Levithan (novel)","Michael Cera, Kat Dennings, Aaron Yoo, Rafi Gavron",English,USA,64.0,6.7,83295,tt0981227,Sony/Screen Gems,True,ok,34077322,36303849,10822563,0.726890756302521,66736576005666277775742671676775757651474674177213476777777512544553
435,Nine,2009,2009-12-25,1.966667,Drama,"Drama, Musical, Romance",PG-13,Rob Marshall,"Michael Tolkin (screenplay), Anthony Minghella (screenplay), Arthur Kopit (Broadway musical ""Nine"""")","Maury Yeston (Broadway musical """"Nine"""")","Mario Fratti (Broadway musical """"Nine"""" Italian original)""","Daniel Day-Lewis, Sandro Dori, Nicole Kidman, Marion Cotillard","English, Italian, French","UK, USA",49.0,5.8,40369,tt0875034,The Weinstein Co.,False,men,21363903,58096258,86858528
436,Ninja Assassin,2009,2009-11-25,1.650000,Action,"Action, Thriller",R,James McTeigue,"Matthew Sand (screenplay), J. Michael Straczynski (screenplay), Matthew Sand (story)","Rain, Joon Lee, Jonathan Chan-Pensley, Ill-Young Kim",English,"Germany, USA",34.0,6.4,63547,tt1186367,Warner Bros. Pictures/Dark Castle Ent.,False,notalk,41391219,66905911,54286580,0.594417077175698,777764363255544734305434413543444444443446437732543443344743533344645332454434367665441
437,No Country for Old Men,2007,2007-11-21,2.033333,Drama,"Crime, Drama, Thriller",R,"Ethan Coen, Joel Coen","Joel Coen (screenplay), Ethan Coen (screenplay), Cormac McCarthy (novel)","Tommy Lee Jones, Javier Bardem, Josh Brolin, Woody Harrelson","English, Spanish",USA,91.0,8.1,746394,tt0477348,Miramax Films,False,dubious,83449513,184318713,28088587,0.834183673469388,7774443677777777775367546777774343677763677774444777777567777777777754467777777777754336313477434677777776346743
438,No Strings Attached,2011,2011-01-21,1.800000,Comedy,"Comedy, Romance",R,Ivan Reitman,"Elizabeth Meriwether (screenplay), Michael Samonek (story), Elizabeth Meriwether (story)","Natalie Portman, Ashton Kutcher, Kevin Kline, Cary Elwes","English, Ukrainian",USA,50.0,6.2,193441,tt1411238,Paramount Pictures,True,ok,73184210,154554145,25892270,0.537698412698413,344325776434443433301477777754543434343435544453444225646333124367453433644443343335443434341214344446443354444457744000004534221143366423335344
439,Notting Hill,1999,1999-05-28,2.066667,Comedy,"Comedy, Drama, Romance",PG-13,Roger Michell,Richard Curtis,"Julia Roberts, Hugh Grant, Richard McCabe, Rhys Ifans","English, Spanish","UK, USA",66.0,7.1,238821,tt0125439,Universal Pictures,True,ok,162347007,508660113,58735405,0.659611992945326,777756764476454645477777556354744435352674235252424353556513367557735553334434343447744323644544344675417634645265746741557776577446746446455777764734656443444437542353432343544744234765675446432444343433775442354445533367643474355534576476143
440,Now You See Me,2013,2013-05-31,1.916667,Horror/Thriller,"Crime, Mystery, Thriller",PG-13,Louis Leterrier,"Ed Solomon (screenplay), Boaz Yakin (screenplay), Edward Ricourt (screenplay), Boaz Yakin (story), Edward Ricourt (story)","Jesse Eisenberg, Mark Ruffalo, Woody Harrelson, Isla Fisher","English, French","USA, France",50.0,7.3,540755,tt1670345,Lionsgate Films,False,notalk,117723989,351723989,75000000,0.810924369747899,77777777206557673537553644565677774445775766766546676657767775277754
441,Nowhere Boy,2009,2010-10-15,1.633333,Drama,"Biography, Drama, Music, Romance",R,Sam Taylor-Johnson,Matt Greenhalgh (screenplay),"Aaron Taylor-Johnson, Kristin Scott Thomas, David Threlfall, Josh Bolt",English,"UK, Canada",67.0,7.1,32413,tt1266029,The Weinstein Company,False,dubious,1569280,8452669,2062890,0.596209912536443,03567676646471213432443422233677546754432333444467776776763564567565444243422002244570053047753540
